ticker,year,chunk_id,category,word_count,zero_shot_summary,zero_shot_bertscore_precision,zero_shot_bertscore_recall,zero_shot_bertscore_f1,zero_shot_flagged,few_shot_summary,few_shot_bertscore_precision,few_shot_bertscore_recall,few_shot_bertscore_f1,few_shot_flagged,source_flesch,zero_shot_flesch,few_shot_flesch
SNAP,2020,SNAP_2020_chunk_50,Risk Factors,270,"We work hard to keep our valuable ideas and technology safe by using legal agreements and protections like patents and trademarks. However, there's a risk that others might copy our work or challenge our rights, which could hurt our business and brand if we can't effectively defend against it.",0.8913,0.8362,0.8629,False,"The company is working hard to protect its valuable ideas and inventions through legal agreements and patents, but there’s a risk that others might copy its products or challenge its rights. If this happens, it could hurt the company's brand and profits, making it harder to compete in the market.",0.8853,0.8352,0.8595,False,13.99,45.57,52.87
SNAP,2020,SNAP_2020_chunk_51,Risk Factors,134,"The company uses open-source software in its products, which means it could face legal challenges from others claiming ownership or demanding that it share its software for free. If this happens, it could lead to expensive lawsuits, force the company to change its products, or even stop selling them until they can be modified to avoid legal issues.",0.8997,0.8636,0.8813,False,"Using open-source software could lead to legal claims from others who say they own it, which might force the company to share its own software for free, pay for licenses, or stop selling certain products until they can fix any issues, potentially leading to high costs.",0.8863,0.8577,0.8718,False,13.13,47.58,38.76
SNAP,2020,SNAP_2020_chunk_52,Risk Factors,85,"Our business relies on having interesting content for Snapchat users, much of which comes from our users themselves, including celebrities and brands. If these contributors stop sharing engaging content, we could lose users and advertisers, which would hurt our business.",0.9211,0.8864,0.9034,False,"The company's success relies on users creating interesting content for Snapchat; if influential users stop contributing, it could lead to fewer users and lower engagement, hurting relationships with advertisers and overall business performance.",0.9077,0.8663,0.8865,False,17.83,40.6,1.58
SNAP,2020,SNAP_2020_chunk_53,Risk Factors,177,"Snapchat faces risks from foreign laws that are stricter than those in the U.S., which could lead to government censorship or restrictions on access to the app in certain countries. If this happens, it could hurt Snapchat's user growth and engagement, making it harder for the company to maintain or increase its revenue.",0.9079,0.853,0.8796,False,"Strict foreign laws and government actions could limit access to Snapchat in certain countries, which might hurt user growth and engagement, giving competitors a chance to take over those markets and negatively impact the company's revenue.",0.913,0.8459,0.8782,False,6.1,65.99,26.95
SNAP,2020,SNAP_2020_chunk_54,Risk Factors,103,"If our users spend more time on third-party websites and apps that we link to, it could lead to less time spent on our platform, which might hurt our advertising revenue. While we think that partnering with others can bring long-term benefits, it might not be enough to make up for the potential loss in income.",0.9086,0.8884,0.8983,False,"If users spend more time on third-party websites and apps linked to our products, it could lead to less engagement with our platform, potentially hurting our advertising revenue and overall business.",0.9163,0.8749,0.8951,False,24.14,59.07,28.0
SNAP,2020,SNAP_2020_chunk_55,Risk Factors,236,"The company believes that its brand is key to its success and attracting new users, advertisers, and partners. However, if they fail to keep users happy with their products or if changes upset users, it could hurt their brand and business, potentially requiring costly investments that may not pay off.",0.8954,0.8468,0.8704,False,"The company's success relies heavily on its brand reputation, and if it fails to keep users and partners happy or introduces unpopular changes, it could damage that reputation. Additionally, maintaining and improving the brand may require significant investments, which might not always pay off, potentially harming the business.",0.8923,0.8453,0.8681,False,33.6,47.79,20.33
SNAP,2020,SNAP_2020_chunk_56,Risk Factors,113,"The company and its founders get a lot of media attention, which can lead to negative press or scrutiny from lawmakers and regulators. If this happens, it could damage the company's reputation, reduce user engagement and loyalty, and ultimately hurt its revenue and growth.",0.9102,0.8638,0.8864,False,"Negative media attention or regulatory scrutiny could damage the company's reputation, leading to a loss of users and revenue, as well as decreased growth and engagement with its products.",0.9095,0.856,0.8819,False,5.97,34.53,16.95
SNAP,2020,SNAP_2020_chunk_57,Risk Factors,51,"Expanding our business internationally takes a lot of time, money, and focus. If we struggle in these new markets, we could face high costs, hurt our brand reputation, or even have to reduce our workforce, which could negatively impact our overall business.",0.9367,0.9318,0.9342,False,"Expanding into international markets takes a lot of time and money, and if the company struggles in these areas, it could face high costs, harm its reputation, or even have to reduce its workforce, all of which could hurt the business significantly.",0.9285,0.9264,0.9275,False,13.41,42.51,29.25
SNAP,2020,SNAP_2020_chunk_58,Risk Factors,228,"We might struggle to make payments on our debt, including Convertible Notes, if our business doesn't perform well in the future. If we can't generate enough cash, we may have to sell assets or take on more debt, which could hurt our financial situation and lead to serious consequences if we don't meet our debt obligations.",0.9074,0.843,0.874,False,"The company's ability to pay back its debts depends on its future performance, which is uncertain and influenced by factors it can't control. If it struggles to generate enough cash, it may have to sell assets or take on more debt under unfavorable conditions, which could lead to financial trouble and potentially defaulting on its obligations.",0.9021,0.8407,0.8703,False,20.16,45.47,36.41
SNAP,2020,SNAP_2020_chunk_59,Risk Factors,207,"If a major change happens in the company, holders of the Convertible Notes can ask us to buy back their notes at full value plus any interest owed. Additionally, if this change occurs before the notes are due, we might have to offer better terms for those who want to convert their notes into shares, but we may not have enough cash on hand to make these payments when needed.",0.8931,0.8459,0.8689,False,"If a major change happens in the company, holders of the Convertible Notes can demand that the company buy back their notes at full value, which could strain the company's finances. Additionally, if certain conditions are met, the company might have to pay more or provide cash when these notes are converted, and it may not have enough cash on hand to meet these obligations.",0.8802,0.8371,0.8581,False,12.08,57.7,47.6
SNAP,2020,SNAP_2020_chunk_60,Risk Factors,53,"The company has spent a lot of money to cover taxes related to employee stock awards, and it may continue to do so. How we pay for these taxes could either cost us a lot more money or reduce the value of existing shares, which could hurt our overall financial health.",0.902,0.902,0.902,False,"The company may need to spend a lot of money to cover tax costs related to employee stock awards, which could either hurt its finances or reduce the value of existing shareholders' investments.",0.8985,0.8865,0.8925,False,42.66,56.54,37.47
SNAP,2020,SNAP_2020_chunk_61,Risk Factors,118,"When our employees earn stock awards, we need to pay taxes on their behalf, which we can cover by using our cash or selling some of their shares. If we continue to do this in the future, it could negatively impact our financial health.",0.9125,0.8649,0.8881,False,"When employees receive stock awards, the company needs to pay taxes on their behalf, which can strain its finances if it has to sell shares to cover these costs. This could negatively impact the company's financial health.",0.8983,0.8501,0.8735,False,30.63,61.45,60.01
SNAP,2020,SNAP_2020_chunk_62,Risk Factors,148,"If we sell shares for our employees, it might lower our stock price, even though it shouldn't dilute existing shares. Additionally, if we need to raise money by issuing new shares or borrowing, it could also hurt our stock price and increase our debt costs, which could negatively impact our business.",0.9214,0.8638,0.8917,False,"Selling shares for employee compensation could lower the company's stock price, and if the company needs to raise money through borrowing or issuing new shares, it might further hurt the stock value and dilute existing shareholders' ownership. Additionally, relying on borrowed funds could increase costs and negatively impact the business.",0.9015,0.8513,0.8757,False,24.09,48.25,32.56
SNAP,2020,SNAP_2020_chunk_63,Risk Factors,113,"Our products, like Snapchat and Spectacles, are complex and may have hidden software bugs or hardware issues that could lead to problems such as poor performance or security risks. Even though we regularly update our products, some issues might only be found after they are used by customers.",0.9152,0.8737,0.894,False,"The company's products are complex and may have hidden software or hardware issues that could lead to poor performance, security risks, or even product failures, which might only be discovered after customers start using them.",0.9043,0.8567,0.8799,False,34.99,50.29,31.12
SNAP,2020,SNAP_2020_chunk_64,Risk Factors,92,"Our products could have defects or issues that might hurt users, and if these problems are found after we sell them, it could lead to fewer sales and customers, hurting our business. Additionally, if we discover any software errors or security flaws later on, it could damage our reputation and lead to financial losses.",0.9171,0.8693,0.8926,False,"If our products have defects or issues after they are released, it could lead to safety concerns, loss of customers, damage to our reputation, and potential legal claims, all of which could significantly hurt our business.",0.9164,0.8686,0.8918,False,25.82,41.56,29.3
SNAP,2020,SNAP_2020_chunk_65,Risk Factors,82,"We might get sued over issues with our products, which can be expensive and hurt our reputation, even if the claims aren't valid. If our insurance doesn't cover these costs or if we can't get good insurance in the future, it could really hurt our business.",0.9019,0.8728,0.8871,False,"The company may face lawsuits over product issues, which can be expensive and damage its reputation, and if its insurance isn't enough or hard to get, it could face serious financial problems.",0.9043,0.8658,0.8846,False,17.86,54.75,34.24
SNAP,2020,SNAP_2020_chunk_66,Risk Factors,145,"The company may face investigations from government agencies, which could force it to change its practices, incur fines, or spend a lot on legal fees, potentially harming its business. In the past, it dealt with inquiries from the U.S. Department of Justice and the SEC regarding its initial public offering disclosures, but those investigations have since been closed.",0.9196,0.8681,0.8931,False,"The company may face future investigations from government agencies, which could lead to costly fines, changes in business practices, and distractions for management, potentially harming the overall business.",0.9125,0.8468,0.8784,False,23.61,47.18,12.24
SNAP,2020,SNAP_2020_chunk_67,Risk Factors,386,"The company faces risks from lawsuits related to intellectual property, such as patents and copyrights, which are common in the tech industry. These legal challenges could lead to increased costs and negatively impact the business if the company loses or has to pay for licenses.",0.8784,0.7996,0.8371,True,"The company faces risks from legal disputes over intellectual property, such as patents and trademarks, which could lead to costly lawsuits and affect its ability to operate. If the company loses these cases or has to pay for licenses, it could hurt profits and the overall value of its products.",0.8776,0.7988,0.8364,True,30.59,39.24,41.02
SNAP,2020,SNAP_2020_chunk_68,Risk Factors,140,"We depend on certain laws to protect the content we share with users, but these laws can be interpreted differently by courts and may change over time. If these protections weaken or don't apply in other countries, we could face legal issues that could hurt our business.",0.9062,0.8549,0.8798,False,"Changes in laws and regulations regarding online content could lead to legal risks for the company, potentially resulting in lawsuits and harming the business if protections are weakened or interpreted differently.",0.8917,0.8434,0.8669,False,23.11,60.58,17.09
SNAP,2020,SNAP_2020_chunk_69,Risk Factors,270,"The company is facing many lawsuits from users and investors, which could lead to large financial penalties or changes in how they operate. Even if they win some cases, defending against these lawsuits is expensive and takes up a lot of time and resources.",0.897,0.8155,0.8543,False,"The company faces ongoing lawsuits from users and investors, which could lead to costly legal battles and significant financial penalties. Even if the company wins, defending against these lawsuits can be expensive and distract management from running the business effectively.",0.8969,0.8106,0.8516,False,27.46,51.84,25.8
SNAP,2020,SNAP_2020_chunk_70,Risk Factors,240,"Snapchat faces legal risks from content shared on its platform, including potential lawsuits for defamation, privacy violations, and other issues, especially since it doesn't monitor most of this content. Changes in laws, both in the U.S. and abroad, could increase these risks and lead to costly legal battles or fines, which could negatively impact the business.",0.8947,0.8457,0.8695,False,"The company could face lawsuits over content shared on Snapchat, which it doesn't monitor closely, leading to potential legal costs and damages. Changes in laws, especially outside the U.S. and proposed changes in U.S. protections, could increase liability risks and result in fines or restrictions on its services, harming the business.",0.9044,0.8426,0.8724,False,28.55,48.9,51.23
SNAP,2020,SNAP_2020_chunk_71,Risk Factors,191,"The company plans to expand its business internationally, which involves entering new markets where it has little experience. This could lead to challenges in making money and managing costs, especially if they struggle to attract users or face currency fluctuations.",0.8983,0.847,0.8719,False,"Expanding into new international markets where the company has little experience could lead to challenges in effectively selling and managing products, potentially increasing costs without boosting revenue. Additionally, fluctuations in foreign currencies and various international business risks could further impact the company's financial performance.",0.9138,0.8563,0.8841,False,26.25,32.14,-9.69
SNAP,2020,SNAP_2020_chunk_72,Risk Factors,133,"Changes in international tax laws could increase our tax costs, which might negatively impact our business. For instance, recent tax reforms in the U.S. have altered how companies are taxed, potentially affecting our financial performance.",0.9019,0.8424,0.8712,False,"Changes in international business tax laws could increase the company's tax expenses, which may hurt profits and overall business performance.",0.9061,0.8361,0.8697,False,34.25,40.3,30.03
SNAP,2020,SNAP_2020_chunk_73,Risk Factors,100,"There are ongoing discussions and proposals in various countries that could change how companies like ours are taxed, especially for digital services. This could mean new taxes based on total sales rather than profits, and potentially even taxes in countries where we don't have a physical office.",0.9115,0.8769,0.8939,False,"Changes in tax laws, including new taxes on digital services regardless of profit, could increase the company's tax burden and affect its financial performance in various countries where it operates.",0.9113,0.8556,0.8826,False,9.72,42.58,21.29
SNAP,2020,SNAP_2020_chunk_74,Risk Factors,281,"Brexit has created a lot of uncertainty for businesses operating in the UK and Europe, including potential changes in regulations and market conditions. This could affect our operations and the way we handle data, as well as disrupt trade and movement between the UK and EU, making it hard to predict future impacts on our business.",0.8737,0.8244,0.8483,True,"The UK's decision to leave the European Union (Brexit) has created ongoing political and economic uncertainty, which could lead to market volatility and affect regulations, including data protection. This uncertainty may disrupt business operations and the movement of goods, services, and people between the UK and the EU, impacting the company's performance.",0.9016,0.8362,0.8677,False,19.53,34.9,9.62
SNAP,2020,SNAP_2020_chunk_75,Risk Factors,277,"The company plans to grow by buying other businesses and technologies, but there's a risk that these acquisitions may not work out as intended. They might struggle to find good acquisition targets, successfully integrate new companies, or manage the costs and potential debts that come with these deals, which could negatively impact their overall business and stock value.",0.8836,0.836,0.8592,False,"The company plans to buy other businesses and technologies to grow, but it may struggle to find good opportunities or successfully integrate them. If these acquisitions don't go well, they could harm the company's performance and financial health, and could also lead to increased debt or dilution of existing shareholders' equity.",0.884,0.8379,0.8603,False,16.66,38.83,34.98
SNAP,2020,SNAP_2020_chunk_76,Risk Factors,68,"When we buy another company, it can take a while to determine the exact value of what we purchased. This means that we might later find out that the value is different than we thought, which could lead to unexpected losses and negatively impact our business.",0.8963,0.8792,0.8877,False,"It can take months to determine the final value of an acquisition, which means the company might face unexpected losses or changes in asset values that could negatively impact its financial health.",0.9144,0.8893,0.9017,False,8.1,56.59,31.59
SNAP,2020,SNAP_2020_chunk_77,Risk Factors,94,"Our ability to buy other companies or make investments could be at risk if we don't appeal to potential sellers or if we can't quickly finalize deals. If we issue more shares to pay for these acquisitions, existing shareholders might see their ownership value decrease, and if we gain a bad reputation in the market, it could hurt our chances of making important purchases that are vital for our growth.",0.8966,0.8656,0.8808,False,"If the company struggles to attract target companies for acquisitions or faces delays in closing deals, it could harm its growth strategy. Additionally, issuing new shares to fund these acquisitions might dilute the value for existing shareholders, and a negative reputation could make it harder to complete important transactions.",0.906,0.867,0.8861,False,5.83,37.16,26.58
SNAP,2020,SNAP_2020_chunk_78,Risk Factors,108,"As our company grows, we might start giving some partners credit to buy our products, but this comes with risks since we can't guarantee that all partners will pay us back, especially if they are new or unfamiliar to us. If we can't manage these credit risks well, it could negatively impact our business.",0.9004,0.8784,0.8893,False,"As the company grows, it may start offering credit to partners, but this could lead to financial risks if those partners can't pay back what they owe, especially if they are new or unfamiliar. If these credit risks aren't managed well, it could seriously hurt the business.",0.8986,0.8719,0.885,False,21.46,57.23,60.58
SNAP,2020,SNAP_2020_chunk_79,Risk Factors,130,"If unexpected events disrupt our operations, it could hurt our ability to manage our finances and meet our obligations. Additionally, we have certain rules in our loan agreements that limit how we can borrow money or make financial decisions, and failing to follow these rules could lead to serious financial consequences.",0.9039,0.8527,0.8776,False,"Unexpected events could disrupt the company's operations and make it difficult to meet financial obligations. Additionally, strict rules in our loan agreements limit our financial activities, and failing to follow these rules could lead to serious financial consequences, including having to repay loans immediately.",0.8993,0.8468,0.8723,False,5.95,21.71,7.61
SNAP,2020,SNAP_2020_chunk_80,Risk Factors,297,"Our tax obligations depend on how we structure our business and handle transactions, especially regarding our intellectual property. Changes in tax laws or how tax authorities interpret them could lead to higher taxes for us, which might negatively impact our business. Additionally, our tax situation can fluctuate based on our earnings and the jurisdictions we operate in, and any audits or reviews by tax authorities could also harm our financial health.",0.9076,0.8441,0.8747,False,"Changes in tax laws and how the company values its assets could lead to higher taxes, which might hurt profits. Additionally, tax audits and uncertainties in tax calculations could result in unexpected tax liabilities that negatively impact the business.",0.8893,0.8245,0.8556,False,12.9,23.15,33.03
SNAP,2020,SNAP_2020_chunk_81,Risk Factors,194,"The company has significant tax benefits from past losses and research credits, but if there are major changes in ownership of the company’s stock, it could lose the ability to use these tax benefits to lower future tax bills. This means that if too many shareholders change hands, the company might face higher taxes than expected.",0.8807,0.8169,0.8476,True,"If the company undergoes significant changes in ownership, it may lose the ability to use its large tax losses and credits to lower future tax bills, which could increase its tax expenses and reduce profits.",0.8891,0.8121,0.8488,True,45.6,45.47,33.53
SNAP,2020,SNAP_2020_chunk_82,Risk Factors,185,"Changes in tax laws limit how much of our past losses we can use to reduce future taxable income, which could hurt our financial situation. In the U.K., while we can carry forward losses indefinitely, we can only use half of those losses in any given year, and there are additional rules that might restrict their use.",0.8954,0.838,0.8657,False,"Changes in tax laws limit how much of our past losses we can use to offset future profits, which could hurt our financial situation and ability to manage taxes effectively. Additionally, in the U.K., we face restrictions on using these losses that could further impact our earnings.",0.8898,0.816,0.8513,False,14.11,58.42,46.93
SNAP,2020,SNAP_2020_chunk_83,Risk Factors,118,"We regularly check the value of our intangible assets, like goodwill from acquisitions, to make sure they are still worth what we paid for them. If market conditions change negatively, it could lead to a significant loss in value, which would hurt our business financially.",0.8982,0.8428,0.8696,False,"If market conditions worsen, the company may have to reduce the value of its intangible assets, like goodwill, which could lead to significant financial losses and negatively impact its business.",0.9013,0.8343,0.8665,False,31.3,46.76,24.11
SNAP,2020,SNAP_2020_chunk_84,Risk Factors,171,"The company has been losing money and may struggle to become profitable, which means it might need to borrow more money in the future. If it does, this could lead to existing shareholders owning a smaller piece of the company, and if the company can't secure funding on good terms, it could face serious financial challenges.",0.8802,0.8362,0.8576,False,"The company has been losing money and may need more funding to stay afloat, but getting that funding could be difficult and expensive. If it raises money by selling more shares or debt, existing shareholders might see their ownership reduced, and higher borrowing costs could hurt the business even more.",0.8872,0.8379,0.8618,False,20.09,48.49,51.18
SNAP,2020,SNAP_2020_chunk_85,Risk Factors,52,"We rely on other companies to make our products, and if they face any issues or delays, we might not be able to deliver our products to customers on time, which could hurt our business.",0.9394,0.9113,0.9251,False,"The company relies on outside manufacturers to produce its products, so any issues or delays with these manufacturers could lead to late deliveries, harming sales and overall business performance.",0.9103,0.8858,0.8979,False,21.01,43.2,16.95
