ticker,year,chunk_id,category,word_count,zero_shot_summary,zero_shot_bertscore_precision,zero_shot_bertscore_recall,zero_shot_bertscore_f1,zero_shot_flagged,few_shot_summary,few_shot_bertscore_precision,few_shot_bertscore_recall,few_shot_bertscore_f1,few_shot_flagged,source_flesch,zero_shot_flesch,few_shot_flesch
MSFT,2021,MSFT_2021_chunk_01,Risk Factors,64,"Our business relies on building platforms that allow various users and developers to create solutions, which helps us grow faster. However, we face tough competition from other companies offering similar platforms, and we need to grow significantly to keep our profits high.",0.9117,0.8811,0.8961,False,"Building a successful platform that attracts many users and developers is crucial for the company's growth and profitability, but it faces tough competition from other companies offering similar platforms.",0.9174,0.878,0.8973,False,13.46,30.42,5.28
MSFT,2021,MSFT_2021_chunk_02,Risk Factors,118,"Some companies have found success by controlling both the hardware and software of their products, which allows them to offer integrated services and potentially improve security and performance. If we decide to focus more on this approach, it could lead to higher costs and lower profit margins for us.",0.9064,0.8654,0.8854,False,"If the company shifts more of its business to a model where it controls both hardware and software, it could lead to higher costs and lower profits, especially since competitors using this approach may have advantages in security, performance, and additional revenue from services.",0.9058,0.8598,0.8822,False,15.11,43.85,16.05
MSFT,2021,MSFT_2021_chunk_03,Risk Factors,157,"We make a lot of money from selling licenses for our Windows operating systems on PCs, but we're facing tough competition from smartphones and tablets that are becoming more popular for tasks traditionally done on PCs. This competition could hurt our profits and make it harder to attract developers to create applications for our operating system.",0.9171,0.8606,0.8879,False,"The company relies heavily on revenue from Windows licenses for PCs, but faces tough competition from smartphones and tablets that could reduce demand for PCs. This competition, along with low-cost alternatives, may hurt profit margins and make it harder to attract developers to create applications for its operating system.",0.9106,0.8529,0.8808,False,25.8,25.83,23.13
MSFT,2021,MSFT_2021_chunk_04,Risk Factors,121,"We face tough competition from other platforms that have a lot of popular apps and content, which can influence customers' buying choices. To stay competitive, we need to attract developers to create high-quality apps for our platform, but doing so might increase our costs and reduce our profits. Additionally, competitors may have rules that limit how we can offer our products and services.",0.9111,0.8743,0.8924,False,"The company faces challenges from competing platforms that offer a wide range of popular content and applications, which can influence customers' buying choices. To stay competitive, the company needs to attract developers to create high-quality apps for its platform, but this could increase costs and reduce profits, especially if competitors impose restrictions on how products and services can be offered.",0.9034,0.8713,0.8871,False,15.07,39.15,21.29
MSFT,2021,MSFT_2021_chunk_05,Risk Factors,72,"As we shift our business to more subscription-based services, we still rely heavily on selling software licenses, which brings in a lot of our revenue. We invest in creating new software products, and while we earn money from licensing them, we face competition from other companies that do the same.",0.9152,0.8878,0.9013,False,"As the company shifts to a new business model, it still relies heavily on revenue from its traditional software licensing, which requires significant investment in research and development. Competing with other companies that also sell similar software could impact profitability and growth.",0.8985,0.8736,0.8859,False,14.45,44.41,18.33
MSFT,2021,MSFT_2021_chunk_06,Risk Factors,60,"Some companies compete with us by offering free versions of software that are similar to ours, funded by ads or other services. This means they don't have to spend as much on developing their products, which can make it harder for us to attract customers.",0.9007,0.8859,0.8932,False,"Competitors offering free or low-cost software that mimics our products could attract customers away from us, making it harder to maintain sales and profitability since they don't have to cover the same development costs.",0.8974,0.8791,0.8881,False,44.13,58.04,23.03
MSFT,2021,MSFT_2021_chunk_07,Risk Factors,199,"We're focusing more on cloud services, which could be risky because we're competing with other companies that are also rapidly improving their cloud offerings. If we can't keep up with these changes and attract enough users to our services, we might struggle to meet our business goals.",0.8869,0.836,0.8607,False,"As the company shifts its focus to cloud-based services, it faces risks in executing its strategy and competing against rivals who are also rapidly advancing in this area. If it fails to gain enough market share or keep up with evolving technology and user preferences, its growth and profitability could be at risk.",0.8842,0.8394,0.8612,False,27.6,47.98,33.08
MSFT,2021,MSFT_2021_chunk_08,Risk Factors,72,"The company is unsure if its plans will bring in enough users or money to be successful. If they can't improve their operations and attract customers to their new products, they might not make enough revenue, which could hurt their profits.",0.9131,0.8824,0.8975,False,"The company's success depends on whether its strategies can attract users and generate enough revenue; if it fails to improve efficiency or get enough customers for its new products, profits could suffer.",0.9131,0.8818,0.8971,False,17.98,60.16,26.31
MSFT,2021,MSFT_2021_chunk_09,Risk Factors,250,"We invest a lot of money in developing new products and services, but there's no guarantee they will be successful or profitable. If customers don't see enough value in what we offer, it could hurt our sales and overall revenue, especially if our new products don't perform as well as our existing ones.",0.8846,0.8274,0.855,False,"The company invests heavily in new products and services, but there's a risk that these investments may not pay off, leading to lower sales and profits. If customers don't see enough value in the new offerings, or if there are concerns about data handling and product quality, it could hurt the company's revenue and market position.",0.885,0.8303,0.8568,False,11.24,42.66,43.96
MSFT,2021,MSFT_2021_chunk_10,Risk Factors,82,"The company plans to keep buying other businesses and forming partnerships, which could sometimes hurt its performance. For instance, it has made several large acquisitions recently, including GitHub and ZeniMax Media, and is in the process of acquiring Nuance Communications.",0.9039,0.8552,0.8788,False,"Making acquisitions and forming partnerships can be risky and may negatively impact the company's performance, especially if these deals do not go as planned.",0.8636,0.8213,0.8419,True,35.11,32.14,34.43
MSFT,2021,MSFT_2021_chunk_11,Risk Factors,155,"When we acquire other companies or enter into new deals, there are risks involved, such as not achieving our business goals, struggling to integrate new employees and systems, or facing distractions for our management team. If these transactions don't go as planned, it could take longer to see benefits like increased revenue, or we might not see the expected improvements at all, which could negatively impact our financial results.",0.9009,0.8693,0.8848,False,"Acquisitions and partnerships can be risky; they might not help the company grow as planned, could lead to poor returns on investment, and may distract management from other important tasks. Additionally, integrating new employees and systems can be challenging, and if things don't go as expected, it could hurt the company's financial performance.",0.8854,0.8519,0.8683,False,12.72,32.04,36.28
MSFT,2021,MSFT_2021_chunk_12,Risk Factors,172,"If the value of our acquired companies or intangible assets drops significantly, we might have to report a big loss in our earnings. This could happen if our stock price falls or if we expect to make less money in the future, which would hurt our financial results.",0.9046,0.8363,0.8691,False,"If the value of the company's acquired assets or goodwill decreases, it may have to report a large loss, which could hurt its financial performance. This can happen due to factors like a drop in stock price, lower expected profits, or slower industry growth.",0.903,0.8345,0.8674,False,14.44,52.05,55.68
MSFT,2021,MSFT_2021_chunk_13,Risk Factors,211,"Our company faces various cybersecurity threats from hackers and organized groups, including state-sponsored actors, who may try to access our systems or customer data using different tactics, such as exploiting software weaknesses or tricking employees into revealing sensitive information. Additionally, poor security practices, like not promptly removing access for former employees, can also lead to unauthorized data breaches.",0.8991,0.8468,0.8722,False,"The company faces serious risks from cyberattacks by hackers and organized groups, including state-sponsored entities, which could compromise customer data and IT systems. Weak security practices and potential insider threats may also lead to unauthorized access to sensitive information, putting the company's operations and reputation at risk.",0.8963,0.8318,0.8628,False,9.26,-4.93,6.58
MSFT,2021,MSFT_2021_chunk_14,Risk Factors,151,"Cybersecurity threats are becoming more advanced and harder to detect, which means we might not be able to spot some vulnerabilities in our systems. If we experience a security breach, it could disrupt our services, harm our reputation, and lead to financial losses or increased costs to fix the issues.",0.8995,0.8529,0.8756,False,"The company faces serious risks from evolving cyberthreats that could compromise its security systems, disrupt services, harm its reputation, and lead to financial losses. If successful attacks occur, they may also require significant resources to fix the damage and improve defenses.",0.9003,0.848,0.8734,False,-5.72,34.26,20.95
MSFT,2021,MSFT_2021_chunk_15,Risk Factors,67,"The company is at risk of cyberattacks like the Solorigate incident, where hackers infiltrated software updates to access customer systems. This means they could be targeted again because they both provide and use technology services.",0.896,0.8517,0.8733,False,"The company could be at risk of future cyberattacks similar to the Solorigate incident, which could compromise its systems and those of its customers, potentially leading to security breaches and financial losses.",0.888,0.8446,0.8657,False,33.91,36.79,18.37
MSFT,2021,MSFT_2021_chunk_16,Risk Factors,62,"Our company is always trying out new technology and ways to communicate, but this can make it hard to keep our security measures up to date. As we adopt these new tools, we might face risks from new security threats that our current policies aren't prepared for.",0.9034,0.8879,0.8956,False,"As the company adopts new technologies and communication methods, it may struggle to update its security policies and controls, leaving it vulnerable to emerging threats.",0.9141,0.8849,0.8993,False,27.36,51.58,12.26
MSFT,2021,MSFT_2021_chunk_17,Risk Factors,287,"The security of our products is crucial for customers when choosing to use our services, as they rely on us to protect their data from cyber threats. However, we face ongoing risks from hackers targeting our systems and those of our customers, especially as we use more open-source software, which can have its own vulnerabilities.",0.9017,0.8337,0.8664,False,"The security of our products is crucial for customer trust, and threats to our technology can lead to data breaches or service disruptions. If we or our customers don't keep up with security updates, it could leave us vulnerable to cyberattacks, which may harm our reputation and business.",0.891,0.8238,0.8561,False,11.3,37.41,36.19
MSFT,2021,MSFT_2021_chunk_18,Risk Factors,179,"Our customers use a mix of old and new technology from different vendors, and they expect our products to work with all of it, even if some parts aren't very secure anymore. This can make it hard for us to stop supporting outdated systems, which could leave our customers more vulnerable to cyberattacks, especially since they vary widely in their technical skills and resources to implement the latest security measures.",0.9005,0.862,0.8808,False,"The company must support a wide range of outdated and complex IT systems used by its customers, which may leave them vulnerable to security threats. Additionally, varying levels of technical expertise among customers could make it challenging to implement the latest cybersecurity practices effectively.",0.9013,0.8493,0.8745,False,11.14,29.91,15.31
MSFT,2021,MSFT_2021_chunk_19,Risk Factors,115,"Cyberattacks like Solorigate/Nobelium could harm our customers even if our services aren't directly affected. While we promise to inform and support our customers in protecting themselves, we might not always be able to detect these attacks or provide complete guidance, especially for software that runs on their own systems.",0.9251,0.8855,0.9049,False,"Cyberattacks like Solorigate/Nobelium could affect our customers even if our services aren't directly harmed, and while we aim to inform and assist them, we may not always be able to detect or fully understand the extent of these attacks on their systems.",0.9272,0.8793,0.9026,False,19.49,31.76,23.21
MSFT,2021,MSFT_2021_chunk_20,Risk Factors,138,"We need to constantly improve our products and services to protect against security threats, which includes updating software, developing new security technologies, and maintaining strong digital defenses. Additionally, some customers, like those in finance or healthcare, have specific security needs that we must address.",0.9218,0.8713,0.8959,False,"The company must constantly improve its security measures to protect its systems and customers from cyber threats, which can be costly and complex, especially for clients in sensitive industries like finance and healthcare that have specific security needs.",0.9006,0.8491,0.8741,False,-29.95,13.38,16.88
MSFT,2021,MSFT_2021_chunk_21,Risk Factors,192,"Investing in security measures to protect our products and services could cut into our profits. If we don't manage these security risks well, it could hurt our reputation and lead customers to buy less from us or switch to competitors, which would negatively impact our sales and revenue.",0.9205,0.8485,0.8831,False,"Investing in this company carries risks related to the costs of protecting its products and services, which could lower profits. If security issues arise or customers don't keep their systems updated, it could harm the company's reputation and lead to lost sales or legal claims.",0.8971,0.8453,0.8704,False,20.77,37.95,43.0
MSFT,2021,MSFT_2021_chunk_22,Risk Factors,57,"Our products rely on many third-party components, so if there's a security issue with any of them, we could face higher costs, legal problems, lower sales, or damage to our reputation.",0.9454,0.915,0.9299,False,"If a security issue arises in any of the third-party products we rely on, it could lead to higher costs, legal problems, lost sales, or damage to our reputation and competitiveness.",0.9302,0.8991,0.9143,False,20.58,30.73,28.0
MSFT,2021,MSFT_2021_chunk_23,Risk Factors,335,"As we expand our cloud services, we handle more personal data from customers, which makes us vulnerable to data breaches and misuse. If we fail to protect this information, it could damage our reputation, lead to legal issues, and ultimately hurt our business by reducing sales and increasing costs.",0.9037,0.8304,0.8655,False,"The company faces risks related to the protection of customer data, as any breaches or misuse could damage its reputation and lead to legal issues, resulting in higher costs and potential loss of sales. Additionally, concerns about data security may deter customers from using its products and services, impacting growth.",0.8955,0.8289,0.8609,False,12.84,35.21,24.1
MSFT,2021,MSFT_2021_chunk_24,Risk Factors,105,"We might struggle to keep the information in our products safe from others who want to use it without permission. If laws change, it could become easier for people to collect and misuse this information, which could hurt the value of our services.",0.9054,0.8643,0.8844,False,"The company may struggle to keep its valuable information safe from unauthorized use by others, which could reduce the appeal and value of its products and services.",0.9023,0.8603,0.8808,False,33.21,55.16,38.43
MSFT,2021,MSFT_2021_chunk_25,Risk Factors,141,"The company faces risks to its reputation and user engagement from harmful or inappropriate content shared by third parties on its platforms, like GitHub and Xbox. Dealing with these issues may require significant spending on technology and personnel, and if these efforts fail, it could negatively impact the company's business and financial results.",0.9133,0.8603,0.8861,False,"The company's reputation and user engagement could suffer if third parties misuse its products to spread harmful or misleading content, and addressing these issues may require significant investment in resources that might not yield positive results.",0.903,0.8501,0.8757,False,-1.07,29.89,12.85
MSFT,2021,MSFT_2021_chunk_26,Risk Factors,119,"Our services could be misused by others to share harmful or illegal content, which we might not catch right away due to the large volume of content we handle. If this happens, it could hurt our reputation and user trust, and we may face stricter regulations or legal issues, which could negatively impact our business.",0.9151,0.8786,0.8964,False,"The company could face serious problems if harmful or illegal content is shared through its services, as this may damage its reputation and user trust. Additionally, increasing regulations on content moderation could lead to legal issues and higher scrutiny, which might negatively impact the business and its financial performance.",0.9091,0.8728,0.8906,False,4.6,46.64,23.13
MSFT,2021,MSFT_2021_chunk_27,Risk Factors,208,"The growth of the Internet of Things (IoT) brings potential benefits but also significant risks, such as security vulnerabilities and the possibility of product failures. If our IoT products don't work properly or lead to privacy issues, we could face legal problems, increased costs, and damage to our reputation, which could hurt our financial performance.",0.8923,0.8514,0.8714,False,"The growth of Internet of Things (IoT) technology comes with significant risks, including potential security flaws and ineffective products, which could lead to legal issues, increased costs, and damage to the company's reputation if devices fail or mishandle data.",0.8826,0.8416,0.8616,False,29.42,26.64,11.07
MSFT,2021,MSFT_2021_chunk_28,Risk Factors,171,"As we incorporate AI into our products, there are risks that could damage our reputation or lead to legal issues. Problems like flawed algorithms, biased data, or ethical concerns could affect how customers view our AI solutions and ultimately impact our business.",0.9115,0.8598,0.8849,False,"Using AI in our products could lead to problems like flawed algorithms or biased data, which might hurt our reputation and lead to legal issues. If we face backlash over ethical concerns related to AI, it could negatively impact our business and customer trust.",0.9001,0.8552,0.8771,False,30.83,32.43,42.22
MSFT,2021,MSFT_2021_chunk_29,Risk Factors,255,"If we don't keep our technology and infrastructure up to date, we risk experiencing outages and data losses that could disrupt our online services. This could lead to unhappy customers, legal issues, and a negative impact on our financial performance as we grow and introduce new products.",0.9,0.8307,0.864,False,"If the company doesn't keep up with the growing demand for its online services and infrastructure, it could face outages and data losses, leading to unhappy customers and potential legal issues, which could hurt its reputation and financial performance.",0.8876,0.8245,0.8549,False,3.29,31.78,15.4
MSFT,2021,MSFT_2021_chunk_30,Risk Factors,73,"We could face issues with the quality or supply of our hardware products, like Xbox consoles and Surface devices, which might lead to costly recalls or safety alerts if there are defects. This could hurt our finances and damage our reputation if we don't catch or fix these problems early.",0.9175,0.887,0.902,False,"If the company faces issues with the quality or supply of its complex hardware products, it could lead to costly recalls, lost sales, and damage to its reputation.",0.9096,0.8596,0.8839,False,26.84,52.87,45.47
MSFT,2021,MSFT_2021_chunk_31,Risk Factors,89,"Our products and services rely on each other, so if we have quality issues that we don't catch before release, it could lead to lower sales, harm our reputation, and result in costly repairs or legal problems. Even though we try to limit our legal liability through contracts, there's no guarantee those protections will hold up in court.",0.9163,0.8817,0.8986,False,"If the company has quality or reliability issues with its products, it could lead to lower sales, harm its reputation, incur repair costs, delay new releases, or face legal problems, despite efforts to limit liability through contracts.",0.9115,0.8628,0.8865,False,21.47,43.21,16.09
MSFT,2021,MSFT_2021_chunk_32,Risk Factors,148,"We rely on a few key suppliers for important hardware components, and if they face delays or shortages, it could hurt our ability to sell products and maintain our datacenter operations. This could lead to higher costs and reduced profits, especially since our products are assembled in regions that might experience supply chain disruptions.",0.9026,0.8629,0.8823,False,"The company relies on single suppliers for important components, and if those suppliers face delays or shortages, it could lead to reduced sales and higher costs. Additionally, disruptions in the supply chain, especially for products assembled in certain regions, could negatively impact revenue and profit margins.",0.9087,0.8512,0.879,False,17.17,32.16,27.16
MSFT,2021,MSFT_2021_chunk_33,Risk Factors,93,"Government regulations and legal actions regarding competition could restrict how we create and sell our products. As a major player in the software and device industry, we face close examination from authorities in the U.S. and other countries, which could impact our business practices.",0.9299,0.8816,0.9051,False,"Government regulations and legal actions regarding competition could restrict how the company develops and sells its products, potentially impacting its market strategies and operations.",0.9137,0.8511,0.8813,False,16.44,38.13,-4.35
MSFT,2021,MSFT_2021_chunk_34,Risk Factors,198,"The European Commission closely examines how Microsoft designs its popular products and shares technology with other companies, which can lead to legal requirements that limit Microsoft's ability to innovate and increase costs. This scrutiny could allow competitors to create similar products, potentially hurting Microsoft's sales.",0.9085,0.8462,0.8762,False,"The European Commission closely monitors Microsoft's major products and their technology sharing with competitors, which could limit the company's ability to innovate and increase development costs. This scrutiny may also allow competitors to create similar products, potentially hurting Microsoft's sales.",0.9125,0.8434,0.8766,False,8.93,9.16,0.42
MSFT,2021,MSFT_2021_chunk_35,Risk Factors,86,"As we expand our own devices while also working with other companies that make devices for our platforms, we face the risk of not following competition laws properly, which could lead to legal issues. Additionally, some foreign governments, especially in Asia, are pushing for lower payments for our technology, which could impact our profits.",0.9058,0.885,0.8953,False,"As our range of devices expands, we face both collaboration and competition with our partners, which could lead to legal issues if we don't follow competition laws. Additionally, some foreign governments may push for lower payments for our technology, impacting our revenue.",0.9073,0.8781,0.8924,False,24.67,29.03,26.39
MSFT,2021,MSFT_2021_chunk_36,Risk Factors,75,"Government regulations and court rulings could lead to fines or limit how we offer our software, making our products less appealing and hurting our sales. Additionally, new legal challenges could arise based on past cases, which might negatively impact our business in several ways.",0.9267,0.8877,0.9068,False,"Government regulations and legal decisions could lead to fines or limit how we offer our software, making our products less appealing and hurting our sales. Additionally, new legal challenges could arise, which might further impact our business negatively.",0.9243,0.8773,0.9002,False,26.92,36.46,27.26
