ticker,year,chunk_id,category,word_count,zero_shot_summary,zero_shot_bertscore_precision,zero_shot_bertscore_recall,zero_shot_bertscore_f1,zero_shot_flagged,few_shot_summary,few_shot_bertscore_precision,few_shot_bertscore_recall,few_shot_bertscore_f1,few_shot_flagged,source_flesch,zero_shot_flesch,few_shot_flesch
SNAP,2021,SNAP_2021_chunk_113,Risk Factors,77,"When we issued Convertible Notes, we also set up financial strategies to help protect our stock from losing value if those notes are converted into shares. However, there are limits to how much this protection can help.",0.888,0.8554,0.8714,False,"The company has taken steps to protect its stock value when it converts certain debt into shares, but there are limits to how much this protection can help.",0.8743,0.8332,0.8533,False,19.43,55.44,60.58
SNAP,2021,SNAP_2021_chunk_114,Risk Factors,148,"The companies that hedge their investments related to our stock might buy or sell our shares, which could impact the stock price either way. If their hedging strategies don't work out, they might sell off their positions, which could also negatively affect our stock's value.",0.8989,0.8324,0.8644,False,"The actions of financial partners involved in hedging could impact the stock price of the company, either raising or lowering it, especially during key events like converting or repurchasing notes. If these hedging strategies don't work as intended, it could further harm the stock's value.",0.8855,0.8408,0.8626,False,4.71,58.04,44.88
SNAP,2021,SNAP_2021_chunk_115,Risk Factors,53,"Our company's rules are designed to make it harder for someone to take over the company or change its management, which could lead to a lower stock price if investors feel these changes would be beneficial.",0.8974,0.8658,0.8813,False,"Certain rules in our company’s governing documents could make it harder for shareholders to influence changes in management or ownership, which might lead to a lower stock price.",0.8976,0.8674,0.8822,False,28.3,43.4,36.41
SNAP,2021,SNAP_2021_chunk_116,Risk Factors,123,"The company's structure gives Mr. Spiegel and Mr. Murphy significant control over important decisions, including mergers and the election of directors, which could make it harder for other shareholders to push for changes they might want. This concentrated control might discourage potential buyers or investors from pursuing deals that could benefit other shareholders.",0.907,0.8478,0.8764,False,"The company's unique three-class stock structure gives Mr. Spiegel and Mr. Murphy significant control over important decisions, which could make it harder for other shareholders to push for changes like mergers or takeovers that they might want.",0.8999,0.8466,0.8724,False,33.4,35.36,50.27
SNAP,2021,SNAP_2021_chunk_117,Risk Factors,51,"Our board can create and sell special types of stock without needing approval from shareholders, which could give them extra powers that might make it harder for someone to buy the company.",0.8976,0.8686,0.8829,False,"The company's board can create new types of preferred stock without needing approval from shareholders, which could make it harder for potential buyers to take over the company.",0.9023,0.8755,0.8887,False,28.34,50.1,42.45
SNAP,2021,SNAP_2021_chunk_118,Risk Factors,60,"Certain rules in our company’s governing documents or Delaware law might make it harder for someone to take control of the company. This could mean that shareholders might miss out on getting a higher price for their shares, and it could also make our stock less attractive to some investors.",0.9157,0.891,0.9032,False,Rules in our company’s governing documents or Delaware law that make it harder to change ownership could prevent shareholders from getting a higher price for their shares and might lower the appeal of our stock to some investors.,0.9221,0.8892,0.9053,False,4.94,54.56,34.69
SNAP,2021,SNAP_2021_chunk_119,Risk Factors,166,"Certain rules related to our Convertible Notes could make it harder or more expensive for someone to buy our company. If a takeover happens, we might have to pay back the note holders or change the terms of their investment, which could discourage potential buyers from pursuing the acquisition.",0.9048,0.8515,0.8774,False,"Certain rules tied to our Convertible Notes could make it harder or more expensive for another company to buy us, which might discourage potential buyers even if the acquisition would benefit our investors.",0.9132,0.8441,0.8773,False,23.3,45.57,22.09
SNAP,2021,SNAP_2021_chunk_120,Risk Factors,217,"If current shareholders, including employees and service providers, sell a large number of our Class A common stock shares, it could lower the stock's price. Additionally, as more shares are issued through employee stock plans, it may dilute the value for existing shareholders, potentially leading to further declines in the stock price.",0.9137,0.8376,0.874,False,"If current shareholders, including employees and service providers, sell large amounts of the company's stock, it could lower the stock price. Additionally, issuing new shares for employee incentives may dilute existing shareholders' ownership, further impacting the stock's value.",0.9021,0.815,0.8563,False,50.71,42.16,25.03
SNAP,2021,SNAP_2021_chunk_121,Risk Factors,50,"If analysts don't cover our company or provide negative or incorrect information about us, it could lead to a drop in the price or trading activity of our stock.",0.8875,0.8501,0.8684,False,"If analysts don't cover the company or provide negative or incorrect information, it could lead to a drop in the stock price and trading activity.",0.8605,0.8213,0.8405,True,2.11,34.46,39.33
SNAP,2021,SNAP_2021_chunk_122,Risk Factors,158,"The value of our Class A common stock can be affected by what analysts say about us and our competitors. If analysts give us a bad rating, stop covering us, or if our financial results don't meet their expectations, it could lead to a drop in our stock price.",0.9186,0.8618,0.8893,False,"The company's stock price can be negatively affected by unfavorable reports or ratings from analysts, which could lead to a decline in visibility and trading activity. Additionally, limited financial guidance may result in greater fluctuations in the stock price if actual results don't meet analysts' expectations.",0.8786,0.8158,0.8461,True,18.96,54.2,14.29
SNAP,2021,SNAP_2021_chunk_123,Risk Factors,88,"The company has never paid cash dividends to its shareholders and plans to keep any future profits to grow the business instead of paying them out. This means that if you invest in their stock, you will likely only make money if the stock price goes up, and there are also rules that limit their ability to pay dividends.",0.9126,0.8887,0.9005,False,"The company has never paid cash dividends and plans to keep its earnings to grow the business, so investors will only see returns if the stock price goes up; also, there are rules that limit the company's ability to pay dividends in the future.",0.9181,0.8827,0.9001,False,42.22,57.88,37.2
SNAP,2021,SNAP_2021_chunk_124,Risk Factors,192,"We need to ensure our financial reporting processes are effective and comply with strict regulations, which can be expensive and complicated. If we fail to meet these requirements or if our auditors find issues, it could hurt investor confidence in our financial reports and negatively impact our stock price, as well as lead to investigations by regulatory bodies.",0.91,0.8501,0.879,False,"If the company fails to maintain effective financial controls or cannot meet regulatory requirements, it could lead to a loss of investor confidence, negatively impacting stock prices and potentially resulting in costly investigations by regulatory authorities.",0.9041,0.8294,0.8651,False,-26.88,24.24,-13.0
SNAP,2021,SNAP_2021_chunk_125,Risk Factors,116,"We have to follow a lot of rules and regulations related to financial reporting, which can be expensive and time-consuming. This means we may face higher costs and challenges in managing our business as we work to meet these requirements.",0.9116,0.8484,0.8789,False,"Following strict financial reporting rules and regulations can lead to higher costs and more complex operations for the company, which may strain its resources and take time away from other important activities.",0.8908,0.8362,0.8626,False,10.79,51.18,23.66
SNAP,2021,SNAP_2021_chunk_126,Risk Factors,196,"Being a public company means we have to share a lot of information, which can lead to more lawsuits from competitors or others, like the securities class actions we faced after our IPO. These legal issues can be costly and take time away from running our business, potentially harming our overall performance, even if we win the cases.",0.8944,0.8334,0.8629,False,"Increased public visibility can lead to more lawsuits against the company, which may result in high legal costs and distract management from running the business. Even if the company wins these cases, the time and resources spent on them could still negatively impact operations.",0.8955,0.82,0.8561,False,27.34,40.29,42.22
SNAP,2021,SNAP_2021_chunk_127,Risk Factors,62,Our company’s rules state that any legal disputes with shareholders must be handled in specific courts in Delaware or federal courts in the U.S. This could make it harder for shareholders to find a court that they believe would be more favorable for their case.,0.9026,0.8744,0.8883,False,"Stockholders may have a harder time resolving disputes with the company or its leaders because they can only take legal action in specific courts, which might not be the most favorable for them.",0.8873,0.8523,0.8694,False,-14.38,58.04,42.59
SNAP,2021,SNAP_2021_chunk_128,Risk Factors,119,"This section explains that if there are legal disputes related to securities laws, they must be handled in federal courts, rather than in state courts, to avoid confusion and conflicting decisions. This means that investors will have a clear and consistent place to resolve their claims.",0.8892,0.856,0.8723,False,"The company has chosen to require that any legal disputes related to securities laws be handled exclusively in federal courts, which helps avoid complications from having to deal with multiple courts and inconsistent rulings.",0.8984,0.8532,0.8752,False,10.17,52.91,13.08
SNAP,2021,SNAP_2021_chunk_129,Risk Factors,178,"This risk factor explains that the company has rules that limit where shareholders can file lawsuits against it or its leaders, which might make it harder for shareholders to take legal action. If a shareholder tries to sue in a different location, the company will likely fight to enforce its rules, which could lead to extra legal costs and potential complications if a court doesn't uphold those rules.",0.8811,0.8397,0.8599,False,"The company's rules may make it harder for shareholders to sue in courts they prefer, which could discourage legal action against the company and its leaders. If shareholders try to challenge these rules in other courts, it could lead to costly legal battles and potential losses for the company.",0.8955,0.8378,0.8657,False,1.02,45.43,52.48
SNAP,2022,SNAP_2022_chunk_00,Risk Factors,152,"This section highlights that there are various risks that could negatively impact the company's business and financial health, which might not be fully known or anticipated. If these risks materialize, it could lead to a drop in the stock price, potentially resulting in losses for investors.",0.8863,0.8282,0.8562,False,"Investors should be aware that there are various risks that could negatively impact the company's business, reputation, and financial health, potentially leading to a decline in stock value and loss of investment. Additionally, there may be unknown risks that could also affect the company in the future.",0.89,0.8188,0.8529,False,25.84,43.72,35.38
SNAP,2022,SNAP_2022_chunk_01,Risk Factors,63,"Our business relies on having a lot of active users who engage with our platform. If we can't keep our current users or attract new ones, or if users start using Snapchat less, it could hurt our company significantly.",0.9351,0.9123,0.9236,False,"If the company can't keep its current users or attract new ones, or if users become less active, it could seriously hurt the business.",0.9289,0.8887,0.9084,False,59.29,54.72,55.58
SNAP,2022,SNAP_2022_chunk_02,Risk Factors,368,"The company had 319 million daily active users (DAUs) on average at the end of 2021, which is crucial for measuring how engaged users are with its app. However, there are risks that the number of DAUs could decline in the future due to factors like increased competition, performance issues, or challenges in attracting older users and users in developing markets, which could negatively impact the company's financial performance.",0.8992,0.8319,0.8643,False,"The company relies on daily active users (DAUs) for engagement and growth, but it faces challenges in attracting and retaining users due to competition, potential performance issues, and market saturation. If DAU growth slows or declines, the company's financial success will depend more on how well it can boost user activity and generate revenue from its existing users.",0.8844,0.8239,0.8531,False,18.66,29.59,25.7
SNAP,2022,SNAP_2022_chunk_03,Risk Factors,198,"Snapchat faces risks because it's easy for users to switch to other platforms, especially since its main audience of young adults tends to follow trends rather than stay loyal to one app. If users leave or don't engage as much, it could hurt Snapchat's appeal to advertisers and its overall business.",0.8857,0.834,0.859,False,"Snapchat faces risks from low barriers for new competitors and users easily switching to other platforms, especially since its main audience is young and trend-driven, which could lead to declining user numbers and engagement. If Snapchat struggles to keep users or attract different age groups, it may become less appealing to advertisers, harming its business.",0.8969,0.8413,0.8682,False,43.6,58.2,37.41
SNAP,2022,SNAP_2022_chunk_04,Risk Factors,291,"Snapchat relies heavily on mobile devices and must work well with popular operating systems like Android and iOS, as well as their app stores. However, since companies like Google and Apple control these platforms and can change their rules or prioritize their own products, any unfavorable changes could hurt Snapchat's performance and user experience.",0.8947,0.8382,0.8656,False,"Snapchat relies heavily on mobile devices and must work well with popular operating systems like Android and iOS, which are controlled by companies like Google and Apple. If these companies change their systems or prioritize their own products, it could make Snapchat less functional or harder to access, negatively affecting user engagement and growth.",0.8956,0.8353,0.8644,False,5.08,36.86,36.86
SNAP,2022,SNAP_2022_chunk_05,Risk Factors,147,"Our products rely on fast internet connections, so if data costs rise or network access becomes limited, it could hurt our ability to keep and grow our user base. Additionally, changes to mobile operating systems or new internet regulations could negatively affect how well our products work and increase our expenses.",0.9297,0.8701,0.8989,False,"If data costs rise or access to cellular networks becomes limited, it could hurt user retention and growth for the company. Additionally, changes to mobile operating systems or regulations could affect how well the company's products work, potentially leading to performance issues and increased costs.",0.9307,0.8709,0.8998,False,14.12,23.36,27.96
SNAP,2022,SNAP_2022_chunk_06,Risk Factors,403,"The repeal of open internet rules by the FCC could allow mobile providers to limit access to services like Snapchat, which might make it harder for the company to keep or attract users. Additionally, changes in regulations from the European Union could increase costs and further impact the business if they impose new requirements on internet services.",0.8922,0.817,0.8529,False,"Changes in internet regulations, both in the U.S. and Europe, could allow mobile and internet providers to limit access to our services, making it harder for us to keep current users and attract new ones, which could hurt our business significantly.",0.9008,0.8073,0.8515,False,8.85,33.94,41.59
SNAP,2022,SNAP_2022_chunk_07,Risk Factors,83,"We might struggle to build important partnerships or create products that work well with existing technologies and regulations. If users find it harder to access Snapchat on their mobile devices or decide to use other apps instead, it could hurt our business and reduce the number of active users.",0.9304,0.907,0.9185,False,"If we struggle to build important partnerships or create products that work well with existing technologies, it could make it harder for users to access Snapchat, leading to fewer users and lower engagement, which would hurt the business.",0.9171,0.8818,0.8991,False,17.94,45.57,34.69
SNAP,2022,SNAP_2022_chunk_08,Risk Factors,281,"The company relies heavily on Google Cloud and Amazon Web Services (AWS) for its computing needs, and if either service experiences disruptions or if switching to another provider becomes necessary, it could be costly and time-consuming. This reliance means that any issues with these cloud services could lead to a loss of users, partners, and advertising revenue, ultimately harming the company's business and reputation.",0.8912,0.8475,0.8688,False,"The company relies heavily on Google Cloud and Amazon Web Services for its operations, and any major disruptions or issues with these services could hurt its business, lead to loss of users and revenue, and damage its reputation. Additionally, rising costs for these cloud services could become a financial burden if the company can't increase its revenue quickly enough to keep up.",0.8868,0.8374,0.8614,False,23.36,17.05,29.37
SNAP,2022,SNAP_2022_chunk_09,Risk Factors,64,"Google and Amazon can change their rules and policies whenever they want, which could negatively impact our business and how we use their cloud services. If they make decisions that don't work in our favor, it could hurt our operations significantly.",0.9243,0.9056,0.9148,False,"If Google or Amazon changes their rules or policies in ways that hurt our business, it could negatively impact our operations and profitability.",0.9216,0.8827,0.9018,False,50.35,47.78,25.32
SNAP,2022,SNAP_2022_chunk_10,Risk Factors,80,"Most of our money comes from companies paying to advertise on Snapchat, making up about 99% of our revenue in recent years. While we're trying to get advertisers to commit to longer-term deals, most currently do not, which could make our revenue vulnerable if advertising trends change.",0.9069,0.8698,0.888,False,"The company relies heavily on advertising revenue from third parties, which makes up nearly all of its income; if advertisers choose not to commit long-term, it could lead to unstable revenue and financial challenges.",0.8856,0.8445,0.8645,False,26.85,44.38,23.03
SNAP,2022,SNAP_2022_chunk_11,Risk Factors,205,"We're still in the early stages of building our advertising business, and while some customers are investing significantly, many are just starting and may not spend much with us. If we don't prove that our ads are effective, advertisers might stop using our services, and any economic or political issues could further hurt our revenue and growth.",0.9046,0.8517,0.8774,False,"The company is still building its advertising business, and if it doesn't prove effective or competitive, advertisers may stop using its services. Additionally, economic or political instability could hurt customer budgets and make it harder to predict future advertising revenue, which could significantly impact the business.",0.9047,0.8417,0.8721,False,9.15,33.94,6.93
SNAP,2022,SNAP_2022_chunk_12,Risk Factors,390,"The company depends on collecting and sharing data to attract and keep advertisers. New privacy laws, like the GDPR in Europe and the CCPA in California, impose strict rules on how personal data can be used, which could limit the company's ability to gather useful data and increase costs for compliance and potential legal issues.",0.8983,0.8246,0.8599,False,"Changes in data privacy laws, like the GDPR in Europe and the CCPA in California, could limit the company's ability to collect and share important data for advertisers, making it harder to attract and keep clients, and potentially leading to increased costs and legal risks.",0.8902,0.8197,0.8535,False,2.98,35.87,16.4
SNAP,2022,SNAP_2022_chunk_13,Risk Factors,239,"Apple's recent iOS update has made it harder for companies to access user data, which affects their ability to effectively target and measure ads. This could lead to lower demand and prices for advertising products, potentially harming the company's business, especially since they are still in the early stages of developing their advertising revenue.",0.907,0.845,0.8749,False,"Changes in privacy regulations from major tech companies like Apple and Google could limit the company's ability to effectively target and measure advertisements, leading to lower demand and prices for its advertising products, which may significantly harm its business and revenue growth.",0.9013,0.8399,0.8695,False,8.37,24.33,1.05
SNAP,2022,SNAP_2022_chunk_14,Risk Factors,96,"The two co-founders of the company, Evan Spiegel and Robert Murphy, hold almost all the voting power, meaning they can make key decisions about the company, like who gets to be on the board or if the company should merge or sell itself, without needing approval from other shareholders. This gives them significant control over the company's direction.",0.8977,0.8618,0.8794,False,"The co-founders have almost complete control over the company's voting power, which means they can make key decisions without needing approval from other shareholders, potentially limiting the influence of other investors.",0.8893,0.8407,0.8643,False,35.5,41.75,14.36
SNAP,2022,SNAP_2022_chunk_15,Risk Factors,238,"If either of the company's co-founders, Mr. Spiegel or Mr. Murphy, leaves the company, they can still significantly influence company decisions due to their voting power. Additionally, if one co-founder dies or becomes unable to work, the other could gain almost complete control over the company's voting shares, which could impact shareholder decisions.",0.9043,0.8252,0.863,False,"If either co-founder, Mr. Spiegel or Mr. Murphy, leaves the company or passes away, the remaining co-founder could gain significant control over the company's voting power, which may impact decisions made by shareholders. This means that one person could effectively influence the direction of the company without broader shareholder input.",0.8972,0.8161,0.8547,False,46.18,38.55,35.1
SNAP,2022,SNAP_2022_chunk_16,Risk Factors,163,"The company's co-founders have significant control over decision-making because they can issue non-voting shares that allow them to maintain their voting power even if they sell those shares. This could lead to situations where they make choices that benefit them but may not align with the interests of other shareholders, potentially delaying or preventing changes in company ownership or strategy that other investors support.",0.8843,0.855,0.8694,False,"The co-founders have significant control over the company due to special stock arrangements, which could lead to decisions that benefit them but may not align with the interests of other shareholders, potentially delaying important changes like mergers or sales. This concentrated control also means the co-founders might make risky long-term investments that could negatively impact the business.",0.8942,0.8504,0.8717,False,31.53,23.66,28.0
SNAP,2022,SNAP_2022_chunk_17,Risk Factors,139,"The CEO, Mr. Spiegel, has significant control over the company's daily operations and major decisions, but he and another executive, Mr. Murphy, must act in the best interests of all shareholders. However, since they also own shares, their personal interests might not always align with those of other investors.",0.904,0.8484,0.8753,False,"The CEO and another key executive have significant control over the company's management and strategic decisions, which could lead to situations where their personal interests conflict with those of other shareholders, potentially affecting overall shareholder value.",0.8787,0.8293,0.8533,False,43.87,45.92,-3.6
SNAP,2022,SNAP_2022_chunk_18,Risk Factors,216,"The COVID-19 pandemic has hurt our business by causing advertisers to cut back on spending due to economic uncertainty, labor shortages, and supply chain issues. This has led to decreased advertising revenue, especially since many events that drive ad spending have been canceled or limited, making it hard to predict future earnings.",0.9054,0.8528,0.8783,False,"The ongoing COVID-19 pandemic has hurt our business by causing advertisers to cut back on spending due to their own financial struggles, labor shortages, and supply chain issues. This uncertainty makes it hard to predict future advertising revenue, and any decline in this revenue could significantly harm our business.",0.9164,0.8529,0.8835,False,6.97,34.02,30.03
SNAP,2022,SNAP_2022_chunk_19,Risk Factors,55,"Governments around the world have implemented various measures, like lockdowns and social distancing, to manage the COVID-19 pandemic. These actions could impact our business operations and financial performance, especially if they continue or if new restrictions are introduced.",0.8827,0.8615,0.872,False,"Government restrictions related to the COVID-19 pandemic, like lockdowns and social distancing measures, could disrupt the company's operations and negatively impact its business performance.",0.8939,0.8552,0.8742,False,28.18,25.03,6.23
