ticker,year,chunk_id,category,word_count,zero_shot_summary,zero_shot_bertscore_precision,zero_shot_bertscore_recall,zero_shot_bertscore_f1,zero_shot_flagged,few_shot_summary,few_shot_bertscore_precision,few_shot_bertscore_recall,few_shot_bertscore_f1,few_shot_flagged,source_flesch,zero_shot_flesch,few_shot_flesch
AAPL,2018,AAPL_2018_chunk_00,Risk Factors,471,"The company operates in very competitive global markets where it faces pressure from rivals who often lower prices and quickly introduce new products. To stay competitive, the company needs to invest heavily in research and development to create innovative products, but there's no guarantee these investments will pay off, especially since competitors may copy its ideas or offer cheaper alternatives.",0.8926,0.8147,0.8519,False,"The company operates in highly competitive global markets where rivals often engage in aggressive price-cutting, which can hurt profit margins. To stay relevant, the company must continually invest in research and development to create innovative products, but there's no guarantee these investments will pay off, especially as competitors may copy its features or offer cheaper alternatives.",0.8952,0.8134,0.8524,False,5.96,15.65,13.75
AAPL,2018,AAPL_2018_chunk_01,Risk Factors,166,"The company operates in a fast-changing and competitive market, which means it needs to constantly create and improve its products and services to attract customers. However, there are many uncertainties involved in launching new offerings, such as whether they will be developed on time, accepted by the market, and produced without issues, making it hard to predict how successful these new products will be.",0.8871,0.8504,0.8684,False,"The company faces challenges in staying competitive, as it needs to constantly develop and launch new products and services. Success depends on various factors, including timely development, market acceptance, managing production and inventory effectively, and ensuring quality, making it hard to predict how well new offerings will perform.",0.908,0.8547,0.8805,False,-19.04,32.91,11.51
AAPL,2018,AAPL_2018_chunk_02,Risk Factors,143,"The company relies on mobile carriers to offer financing and discounts for iPhone purchases, but there's no guarantee these offers will continue in the future. Additionally, the company is investing in programs to boost sales through resellers, but these efforts may not pay off, and if resellers face financial issues or lose interest in selling the company's products, it could hurt sales.",0.9,0.8622,0.8807,False,"The company relies on cellular carriers for financing and support to sell iPhones, but there's no guarantee these deals will continue or be as favorable in the future. Additionally, the company is investing heavily in programs to boost sales through resellers, but these efforts may not pay off, and if resellers face financial issues or lose interest in selling the products, it could hurt the company's sales.",0.8934,0.8583,0.8755,False,21.03,36.19,35.2
AAPL,2018,AAPL_2018_chunk_03,Risk Factors,231,"The company may have to write down the value of its inventory and assets if they become outdated or if their costs exceed what they can sell for. Since the tech market is fast-changing and unpredictable, there's a risk that the company could misjudge how much inventory to produce or order, leading to potential financial losses.",0.8845,0.8332,0.8581,False,"The company may face financial losses if it overestimates demand for its products, leading to excess inventory that becomes outdated or unsellable. Additionally, unpredictable market conditions and rapid changes in technology could result in costly write-downs or fees if the company misjudges its production needs.",0.8797,0.8224,0.8501,False,12.13,46.98,14.8
AAPL,2018,AAPL_2018_chunk_04,Risk Factors,355,"The Company relies on a limited number of suppliers for key components, which puts it at risk of supply shortages and price increases that could hurt its financial performance. If these suppliers face issues, like financial troubles or industry changes, it could become difficult for the Company to get the parts it needs, especially for new products that require specialized components.",0.8938,0.8282,0.8597,False,"The company relies on a limited number of suppliers for key components, which makes it vulnerable to supply shortages and price increases. If these suppliers face financial issues or if there are industry-wide shortages, it could hurt the company's ability to produce products and negatively impact its financial performance.",0.9024,0.8263,0.8627,False,2.27,33.03,23.13
AAPL,2018,AAPL_2018_chunk_05,Risk Factors,332,"The company relies heavily on a few outsourcing partners in Asia for most of its manufacturing and logistics, which can save money but also means it has less control over product quality and supply. If these partners face issues, like financial troubles or disruptions, it could lead to problems with product availability and potential costs related to defects or warranty claims.",0.8959,0.83,0.8617,False,"The company relies heavily on a few outsourcing partners in Asia for manufacturing and logistics, which can save costs but also means less control over product quality and supply. If these partners face issues like financial troubles or disruptions, it could lead to delays, increased costs, and potential product defects, impacting the company's operations and reputation.",0.8956,0.8259,0.8593,False,16.43,30.25,25.83
AAPL,2018,AAPL_2018_chunk_06,Risk Factors,264,"The Company makes complex hardware and software that can sometimes have defects, which might lead to safety issues or performance problems. If these issues aren't fixed, they could harm the Company's reputation, lead to legal claims, and ultimately result in lost sales and revenue.",0.9117,0.8424,0.8757,False,"The company’s complex hardware and software products may have design or manufacturing defects, which could lead to safety issues, service outages, and customer dissatisfaction. If these problems occur, they could harm the company's reputation, result in costly legal claims, and ultimately reduce sales and profits.",0.9071,0.8475,0.8763,False,19.04,49.91,27.96
AAPL,2018,AAPL_2018_chunk_07,Risk Factors,289,"The Company relies on short-term contracts with various third parties to provide digital content like music and movies, but there's no guarantee these contracts will be renewed or that the terms will remain favorable. If content providers decide to limit access or raise costs, or if new regulations require changes to how the Company manages digital rights, it could hurt the Company's ability to offer a wide range of content at reasonable prices, impacting its financial performance.",0.9088,0.8624,0.885,False,"The company relies on short-term contracts with third parties to offer music, movies, and other digital content, which could be at risk if these partners decide to raise prices, limit access, or offer competing services. If the company can't secure or afford the rights to this content, or if it faces new technology requirements, it could struggle to provide a diverse range of offerings, impacting its financial health.",0.9007,0.8491,0.8741,False,26.19,20.53,34.23
AAPL,2018,AAPL_2018_chunk_08,Risk Factors,319,"The company relies on third-party developers to create and maintain software for its hardware products, and if these developers choose to focus on competitors with larger market shares, it could lead to fewer available applications for the company's devices. This could result in lower customer interest in buying the company's products and reduced sales revenue from its app distribution platforms.",0.9015,0.843,0.8713,False,"The company's success relies on third-party software developers continuing to create and maintain applications for its products. If developers focus on competitors with larger market shares or fail to keep up with rapid technological changes, it could lead to fewer available apps, lower customer satisfaction, and reduced sales and profits for the company.",0.896,0.8412,0.8677,False,14.54,22.7,18.72
AAPL,2018,AAPL_2018_chunk_09,Risk Factors,502,"The company relies on licenses for third-party technology in its products, and while it usually expects to obtain these licenses at reasonable terms, there's no guarantee it will succeed. If it can't secure these licenses or faces legal challenges over intellectual property rights, it could hurt the company's ability to sell products and negatively impact its financial health. Additionally, ongoing and future lawsuits could be costly and disruptive, even if the company believes it has a strong defense.",0.8917,0.8212,0.855,False,"The company relies on licenses for third-party technology to sell its products, and if it can't secure these licenses or faces legal challenges over intellectual property, it could hurt its ability to operate and make money. Ongoing and potential lawsuits related to patent infringement could also be costly and disruptive, impacting the company's financial health and management focus.",0.8812,0.8113,0.8448,True,20.01,24.26,14.03
AAPL,2018,AAPL_2018_chunk_10,Risk Factors,343,"The Company faces various laws and regulations in the U.S. and abroad that impact its operations, including areas like labor, advertising, and telecommunications. Changes in these laws could lead to increased costs, delays in product launches, or restrictions on how the Company does business, which might make its products less appealing to customers.",0.9113,0.8262,0.8667,False,"The company must follow many complex laws and regulations in different countries, which can be costly and time-consuming. Changes in these rules could lead to delays in product launches, increased compliance costs, or even limit the company's ability to sell certain products, making them less appealing to customers.",0.893,0.8191,0.8544,False,-0.31,37.26,34.43
AAPL,2018,AAPL_2018_chunk_11,Risk Factors,233,"The Company makes most of its money from international sales, which means it has to follow many complex laws and regulations in different countries. If it fails to comply with these laws, it could face legal issues that hurt its reputation and growth, and it also faces risks like economic instability and trade disputes that could impact its profits.",0.8976,0.8408,0.8683,False,"The company relies heavily on its international business, which exposes it to various legal and regulatory challenges that could increase costs and impact growth. Additionally, factors like political instability, trade disputes, and credit risks in foreign markets could negatively affect profits and the company's ability to collect payments from customers.",0.8971,0.8403,0.8678,False,6.36,43.54,7.18
AAPL,2018,AAPL_2018_chunk_12,Risk Factors,188,"The company has invested heavily in its retail stores, including costs for equipment, renovations, and leases, especially for high-profile locations that promote its brand. If sales drop or stores underperform, the company could face significant financial losses from lease penalties and other costs, which could negatively affect its overall financial health.",0.9049,0.8526,0.878,False,"The company has invested heavily in its retail stores, which are costly to build and maintain. If sales drop or stores underperform, it could lead to significant financial losses from lease costs, equipment write-offs, and employee severance, especially given the challenges of managing expenses and relationships in the retail sector.",0.9036,0.8514,0.8768,False,14.43,23.36,30.87
AAPL,2018,AAPL_2018_chunk_13,Risk Factors,62,"The Company may invest in new business strategies or buy other companies, which can be risky. These risks include taking management's focus away from current operations, facing unexpected costs, and possibly not making enough money from these investments.",0.9185,0.8918,0.9049,False,"Investing in new business strategies or acquisitions can be risky, as it may distract management, lead to unexpected costs, and not provide the expected returns, which could negatively impact the company's overall performance.",0.9039,0.8767,0.8901,False,13.93,33.93,14.39
AAPL,2018,AAPL_2018_chunk_14,Risk Factors,770,"The Company faces risks from potential failures or disruptions in its technology systems due to various events like natural disasters, cyberattacks, or human error, which could hinder its online services and operations. These issues could lead to unauthorized access to sensitive customer information, damaging the Company's reputation and financial health, and may result in legal consequences or increased costs if it fails to meet data security standards.",0.8918,0.8243,0.8567,False,"The company faces significant risks from potential failures or disruptions in its technology systems, which could be caused by various events like natural disasters, cyberattacks, or human error. Such incidents could lead to loss of customer trust, financial losses, legal issues, and damage to the company's reputation, especially since it handles sensitive information like personal data and payment details.",0.8835,0.8133,0.8469,True,-5.03,8.68,13.43
AAPL,2018,AAPL_2018_chunk_15,Risk Factors,183,"The Company must follow various laws about how it handles personal information, which can be complicated and vary by location. If it fails to comply with these laws, it could face hefty fines, legal issues, and damage to its reputation.",0.8993,0.8455,0.8716,False,"The company must follow various laws about handling personal information, which can be complicated and costly to comply with. If it fails to meet these legal requirements, it could face hefty fines, legal issues, and damage to its reputation.",0.8905,0.8394,0.8642,False,15.15,46.95,43.87
AAPL,2018,AAPL_2018_chunk_16,Risk Factors,58,"The company's future success relies heavily on keeping its top leaders and skilled employees, who are in high demand and face stiff competition from other companies, especially in Silicon Valley. If they can't retain these key people, it could hurt the company's performance.",0.9137,0.8966,0.9051,False,"The company's future success relies heavily on keeping its key executives and skilled employees, but competition for talented workers in the tech industry, especially in Silicon Valley, is fierce.",0.9457,0.9063,0.9256,False,11.12,43.36,16.95
AAPL,2018,AAPL_2018_chunk_17,Risk Factors,414,"Political events, trade disputes, natural disasters, and public health issues can disrupt the global economy and negatively impact the Company and its partners, potentially leading to higher costs and reduced demand for its products. Additionally, the Company faces risks from industrial accidents and other unforeseen events that could hinder its ability to manufacture and deliver products efficiently.",0.9124,0.8301,0.8693,False,"Political events, trade disputes, and natural disasters can disrupt the company's operations and supply chain, leading to higher costs and reduced demand for its products. Additionally, issues like pandemics and industrial accidents could further hinder production and delivery, negatively impacting the company's reputation and financial performance.",0.9049,0.8237,0.8624,False,7.35,4.25,1.42
AAPL,2018,AAPL_2018_chunk_18,Risk Factors,421,"The company's profits can vary widely based on the types of products it sells, where it sells them, and other factors like costs and competition. If demand for its main product drops or if there are issues with new products or supply chains, it could hurt sales and lead to significant fluctuations in the company's stock price, which may affect investor confidence.",0.8893,0.8174,0.8518,False,"The company's profits can vary widely based on the types of products it sells, changes in costs, and market demand, which means that any decline in sales of its main product or issues with new products could hurt its financial performance. Additionally, the stock price is likely to be volatile and may drop if the company doesn't meet growth and profit expectations, potentially affecting investor confidence and employee retention.",0.8956,0.8228,0.8576,False,20.6,51.2,32.04
AAPL,2018,AAPL_2018_chunk_19,Risk Factors,133,"If foreign currencies weaken against the U.S. dollar, the company's sales and profits from those countries will be worth less in dollars, which might lead them to raise prices internationally, potentially hurting sales. On the other hand, if foreign currencies strengthen, it could help their sales but might also force them to lower prices, which could limit their profits.",0.9009,0.8658,0.883,False,"Fluctuations in foreign currencies compared to the U.S. dollar can impact the company's sales and profits from international markets. If the dollar strengthens, the company might need to raise prices abroad, which could lower demand, while a weaker dollar could lead to pricing cuts that hurt profits.",0.9035,0.8637,0.8831,False,17.55,57.82,54.13
AAPL,2018,AAPL_2018_chunk_20,Risk Factors,90,"The company's investments could lose value due to various factors like market conditions, interest rate changes, or political issues. While they haven't faced major losses yet, future changes could lead to significant financial setbacks.",0.9091,0.8598,0.8838,False,"The company's investments could lose value due to various factors like market conditions, interest rate changes, or political issues, which may lead to significant financial losses in the future and negatively impact its overall financial health.",0.9156,0.8721,0.8933,False,-5.03,35.31,10.5
AAPL,2018,AAPL_2018_chunk_21,Risk Factors,214,"The Company sells its products through various channels, including third-party carriers and directly to businesses and government customers. However, a large portion of the money it is owed (trade receivables) is not backed by any guarantees, making it vulnerable to potential losses, especially in certain international markets and due to reliance on a few key vendors in Asia.",0.907,0.8426,0.8736,False,"The company relies on various third parties to sell its products, and a large portion of the money it is owed is not backed by guarantees, making it vulnerable to not getting paid, especially in certain international markets. Additionally, it has significant financial ties to a few vendors, primarily in Asia, which increases the risk of losses if those relationships falter.",0.8866,0.822,0.8531,False,7.83,21.33,28.87
AAPL,2018,AAPL_2018_chunk_22,Risk Factors,202,"The Company faces risks related to taxes in the U.S. and other countries, especially Ireland, where changes in tax rates or laws could impact its financial performance. If tax rates rise or if tax audits result in higher tax bills than expected, it could negatively affect the Company's finances.",0.9133,0.8575,0.8845,False,"Changes in tax rates or tax laws in the U.S. and other countries where the company operates could increase its tax expenses, potentially harming its financial health. Additionally, the company faces scrutiny from tax authorities, and any unfavorable outcomes from tax audits could further impact its finances.",0.9099,0.8519,0.88,False,28.86,52.13,36.13
AAPL,2019,AAPL_2019_chunk_00,Risk Factors,455,"The Company operates in very competitive global markets where rivals often lower prices, which can hurt profit margins. To stay ahead, the Company needs to continuously invest in developing new and innovative products, but there's no guarantee these efforts will pay off, especially since competitors may copy their ideas or offer cheaper alternatives.",0.8959,0.815,0.8535,False,"The company operates in highly competitive global markets where rivals often have more resources and can offer lower prices, putting pressure on profit margins. To succeed, the company must continuously innovate and invest in research and development, but there's no guarantee these efforts will pay off, especially if competitors copy its products or undercut prices.",0.8962,0.815,0.8537,False,6.91,20.31,20.49
AAPL,2019,AAPL_2019_chunk_01,Risk Factors,166,"The company operates in a fast-changing and competitive market, which means it needs to constantly create and improve its products and services to attract customers. However, there are many uncertainties involved in launching new offerings, such as whether they will be developed on time, accepted by the market, and produced without issues, making it hard to predict how successful these new products will be.",0.8873,0.851,0.8688,False,"The company operates in a fast-changing and competitive market, so it needs to constantly develop and launch new products and services. However, there are many uncertainties involved, such as whether customers will accept these new offerings, if they can be produced on time and at the right cost, and if they will meet quality standards, which makes it hard to predict how successful these efforts will be.",0.8856,0.8528,0.8689,False,-19.04,32.91,41.51
AAPL,2019,AAPL_2019_chunk_02,Risk Factors,202,"The Company relies on various distributors, like cellular carriers and retailers, to sell its products, but there's a risk that these partners might not continue to offer financing or support for the products, which could hurt sales. Additionally, the Company invests heavily in programs to boost sales through these resellers, but there's no guarantee that these investments will pay off, especially if the financial health of the resellers declines or if demand for the products changes.",0.8992,0.8499,0.8738,False,"The company relies on various distributors, including carriers and retailers, to sell its products, but there's a risk that these partners may not continue to offer financing or support, which could hurt sales. Additionally, if resellers face financial difficulties or decide to stop selling the company's products, it could negatively impact revenue and market presence.",0.8813,0.8335,0.8567,False,20.49,29.12,23.57
AAPL,2019,AAPL_2019_chunk_03,Risk Factors,231,"The company may have to write down the value of its inventory and assets if they become outdated or if their costs exceed what they can sell for. Since the tech market is fast-changing and unpredictable, there's a risk that the company could misjudge how much inventory to produce or order, leading to potential financial losses.",0.8845,0.8332,0.8581,False,"The company may face financial losses if it overestimates demand for its products, leading to excess inventory that becomes outdated or unsellable. Additionally, unpredictable market changes could result in costly write-downs or fees if the company misjudges its production needs.",0.8794,0.82,0.8487,True,12.13,46.98,19.45
AAPL,2019,AAPL_2019_chunk_04,Risk Factors,356,"The Company relies on a limited number of suppliers for key components, which puts it at risk of supply shortages and price increases that could hurt its financial performance. If these suppliers face issues, like financial troubles or industry changes, it could become difficult for the Company to get the parts it needs, especially for new products that require specialized components.",0.8938,0.8296,0.8605,False,"The company relies on a limited number of suppliers for key components, which makes it vulnerable to supply shortages and price increases. If these suppliers face financial issues or if there are industry-wide shortages, it could hurt the company's ability to produce products and negatively impact its financial performance.",0.9021,0.8279,0.8634,False,3.15,33.03,23.13
AAPL,2019,AAPL_2019_chunk_05,Risk Factors,333,"The company relies heavily on a few outsourcing partners in Asia for most of its manufacturing and logistics, which can save money but also means it has less control over production quality and delivery. If these partners face issues, like financial troubles or disruptions, it could lead to product defects, supply shortages, and financial losses for the company.",0.8961,0.8244,0.8588,False,"The company relies heavily on a few outsourcing partners in Asia for manufacturing and logistics, which can save money but also means less control over product quality and supply. If these partners face issues, like financial troubles or disruptions, it could lead to delays, increased costs, and potential product defects, impacting the company's operations and reputation.",0.8949,0.8253,0.8587,False,15.57,30.08,24.32
AAPL,2019,AAPL_2019_chunk_06,Risk Factors,264,"The Company makes complex hardware and software that can sometimes have defects, which might lead to safety issues or performance problems. If these issues aren't fixed, they could harm the Company's reputation, lead to legal claims, and ultimately result in lost sales and customer trust.",0.9111,0.8427,0.8756,False,"The company’s complex hardware and software products may have design or manufacturing defects, which could lead to safety issues, service outages, and customer dissatisfaction. If these problems occur, they could harm the company's reputation, result in costly legal claims, and ultimately reduce sales and market demand.",0.9089,0.8486,0.8777,False,20.0,50.52,27.16
